{
  "dilemma": "Lucas, 11, vê três da turma 6 cercando o Vinícius, 9, no pátio. Sem agressão ainda, mas tão rindo perto demais. Vinícius está contra a parede. Lucas tá com a barriga gelada — eles são maiores. Pode passar reto e contar pra inspetora depois, ou atravessar o pátio agora.",
  "case_a": {
    "title": "Passa reto, conta pra inspetora discretamente em 2 minutos",
    "body": "Lucas passa, vai direto na sala da inspetora, conta. Argumento: ele não consegue parar três sozinho. Vai virar ele apanhando junto com o Vinícius. A inspetora resolve com autoridade — é o jeito mais seguro e mais eficaz. Se ele se mete agora, vira problema pra dois em vez de um."
  },
  "case_b": {
    "title": "Atravessa o pátio com a barriga gelada e fala 'oi Vini, tá no nosso grupo do trabalho — vamos lá'",
    "body": "Lucas vai, chama o Vinícius, sai junto. Argumento: dois minutos pra ir na inspetora são minutos com Vinícius encurralado. Coragem aqui não é encarar os três; é interromper o círculo. A barriga gelada não vai passar antes — ela passa depois, e só passa porque ele foi com ela. Depois também conta pra inspetora."
  },
  "anchor_question": "Quando 'eu não consigo' é diagnóstico real e quando vira a desculpa que protege quem tá com medo de ter coragem?",
  "reveal": "Coragem não é ausência de medo — é fazer com o medo presente. Quem 'só age quando não tá com medo' nunca age, porque na hora que importa o medo está lá. Os antigos separavam coragem de imprudência: a primeira mede o risco e vai mesmo assim; a segunda nem mede. Lucas atravessando o pátio com a barriga gelada é a primeira."
}
