{
  "dilemma": "Ana, 11, descobre que a melhor amiga Lis contou pra outras um segredo dela — que ela tava com medo da prova. Não enorme, mas era seu. Lis vê Ana sabendo e diz 'foi mal, escapou'. Ana pode dizer 'tudo bem' e seguir, ou 'isso não é tudo bem, preciso pensar'.",
  "case_a": {
    "title": "Diz 'tudo bem' e segue",
    "body": "Ana aceita o 'foi mal'. Argumento: amiga há 4 anos, vale mais que esse vacilo. Se ela fizer drama, perde a amizade. 'Escapou' acontece com todo mundo. Não é o tipo de coisa que justifica desconfiar pra sempre. Engole, esquece, continua."
  },
  "case_b": {
    "title": "Diz 'isso não é tudo bem' e tira um tempo",
    "body": "Ana fala: 'Lis, eu te contei sozinha pra você. Foi mal não basta. Preciso de tempo'. Argumento: dizer 'tudo bem' agora é ensinar a Lis (e ensinar a si mesma) que segredo dela vale pouco. Tirar tempo não é vingança — é deixar a amizade na temperatura real. Se voltar, volta sabendo que a próxima vez Lis vai pensar antes."
  },
  "anchor_question": "Quando 'preservar a amizade' deixa de ser cuidar do outro e vira aceitar ser menos respeitado pra evitar conflito?",
  "reveal": "Confiança não cresce no abraço — cresce na hora que alguém ferra, vê o estrago, e muda o comportamento. Quando você responde 'tudo bem' antes do outro mudar nada, está dispensando o trabalho que ele teria que fazer. Em 6 meses, ele te conta outro segredo achando que é igual. Em 1 ano, vocês são amigos no rótulo e estranhos no fundo."
}
