{
  "dilemma": "Fernanda, 11, lê o conto que a amiga Júlia escreveu pra apresentar na aula. Tá meio confuso no meio, personagem some, final apressado. Júlia tá feliz, esperando o feedback: 'então? gostou?'. Fernanda pode dizer 'amei, muito legal' (Júlia fica feliz, leva pra aula como tá) ou pode falar o que viu.",
  "case_a": {
    "title": "Diz que amou — protege a amiga do desconforto agora",
    "body": "Fernanda fala: 'amei, ficou muito bom'. Argumento: a Júlia escreveu com carinho, tá feliz, e amizade é também isso — apoiar. Feedback duro pode magoar bem antes da apresentação. O professor vai comentar amanhã se tiver problema. O papel da Fernanda é torcer."
  },
  "case_b": {
    "title": "Diz o que viu, em forma que serve",
    "body": "Fernanda fala: 'começo forte, final tem sacada; no meio fiquei perdida na parte X — não soube se a personagem voltou'. Argumento: ela entrega o que só leitora atenta pode dar — antes da aula. 'Amei' agora poupa 5 min de desconforto e custa trabalho rebaixado amanhã. Amizade que serve é a que fala quando ainda dá pra ajustar."
  },
  "anchor_question": "Quando 'eu não quero magoar' deixa de ser cuidado e vira o jeito que a gente nega pra alguém a única chance de melhorar antes de errar publicamente?",
  "reveal": "Feedback formativo (Hattie, 2007) é o que mais move aprendizado — mas só quando: vem antes do produto final, é específico sobre o que mudar, e parte de alguém que já mostrou que torce. Elogio vago não ensina nada. Crítica sem cuidado fere e também não ensina. O ponto difícil é o meio: específico, oportuno, sem destruir."
}
