{
  "dilemma": "Rafael, 12, abre o app de roupa e vê: 'mais de 500 pessoas estão olhando este produto agora'. Logo abaixo: 'Júlio (SP) comprou há 2 minutos'. Ele já tava na dúvida sobre a camisa — agora tá quase clicando 'comprar'. Pode finalizar, ou pode parar 30 segundos pra pensar.",
  "case_a": {
    "title": "Compra — se 500 pessoas tão olhando, vai esgotar",
    "body": "Rafael clica 'finalizar'. Argumento: ele já tava decidido na maior parte. Os 500 + o Júlio confirmam: outras pessoas também acham boa, o produto é mesmo desejado, vai esgotar. Não comprar agora é arriscar perder e arrepender. A informação social é dado real."
  },
  "case_b": {
    "title": "Fecha a aba, espera 24h, decide sem o número na frente",
    "body": "Rafael fecha. Argumento: '500 olhando' e 'Júlio comprou há 2 min' são pop-ups que aparecem pra todo mundo, calculados pra ativar o instinto de manada. Ele não estava decidido antes do contador aparecer — tava em dúvida. Se em 24h ele lembrar e quiser, compra; se esquecer, era impulso, não desejo."
  },
  "anchor_question": "Quando '500 pessoas estão fazendo' deixa de ser informação útil e vira o gatilho que decide por você?",
  "reveal": "Solomon Asch, anos 50, mostrou: pessoas mudam até a percepção visual pra concordar com o grupo. Marcas conhecem isso e plantam números — quase sempre dinâmicos, raramente verdadeiros. Prova social funciona porque o cérebro foi feito pra grupos pequenos onde imitar era seguro; ele não sabe que '500 pessoas' é um JavaScript com timer rodando do lado dele."
}
