{
  "dilemma": "Luana, 11, tá conversando com a melhor amiga, Bia, que começou: 'minha avó foi internada ontem'. Luana sente vontade imediata de dizer: 'nossa, a minha também foi mês passado, ficou 3 dias, sumiu o cabelo, voltou bem' — porque ela quer mostrar que entende. Pode interromper agora, ou pode segurar.",
  "case_a": {
    "title": "Conta da própria avó — mostra empatia, vivência parecida",
    "body": "Luana fala: 'ai, eu sei como é, a minha avó também foi'. Argumento: dividir uma vivência parecida é o que faz a outra se sentir menos sozinha. 'Eu sei' é validação. Bia vai entender que Luana não tá desviando — tá criando ponte. É exatamente o que amigas fazem."
  },
  "case_b": {
    "title": "Segura, pergunta: 'e como você tá?'",
    "body": "Luana respira, pergunta: 'e você, como tá com isso?'. Argumento: a Bia começou a falar sobre a avó dela; em 2 frases o assunto teria virado a avó da Luana. Escutar de verdade é resistir ao impulso de comparar — porque a comparação, mesmo bem-intencionada, sequestra o palco. A Bia precisa do palco agora, não da plateia."
  },
  "anchor_question": "Quando 'eu te entendo, comigo também aconteceu' deixa de ser empatia e vira o jeito que a gente tira a vez do outro?",
  "reveal": "Estudo de Boothby (2018) mostra que pessoas se sentem 'ouvidas' principalmente quando o outro faz perguntas em vez de relatar. Escuta ativa não é silêncio — é manter o foco no outro mesmo quando você tem uma história legal pra contar. A comparação é uma forma educada de mudar de assunto."
}
