{
  "dilemma": "Marcelo, 11, tá na roda do recreio. Júlia começa: 'gente, vocês souberam do Igor? Ouvi dizer que o pai dele tá preso'. Marcelo conhece o Igor — sabe que o pai foi viajar a trabalho, ponto. Pode corrigir agora na frente de todo mundo, ou pode ficar quieto e desviar de assunto.",
  "case_a": {
    "title": "Fica quieto e muda de assunto",
    "body": "Marcelo deixa quieto: 'gente, e o jogo de ontem?'. Argumento: não é problema dele, ele não foi quem espalhou. Corrigir a Júlia na frente dos outros vai gerar climão. O Igor nem tá ali pra defender — depois Marcelo conta pra ele, em particular, pra ver se quer fazer algo."
  },
  "case_b": {
    "title": "Corta na frente: 'isso aí não é verdade, o pai dele tá viajando a trabalho'",
    "body": "Marcelo corta: 'Júlia, isso aí não é verdade, eu conheço o Igor — o pai dele tá viajando'. Argumento: o silêncio dele agora é o que vai sustentar a fofoca rodando o resto do dia. O climão de corrigir Júlia uma vez é pequeno comparado ao climão pro Igor descobrir amanhã que todo mundo achou que pai dele tava preso."
  },
  "anchor_question": "Quando 'não é problema meu' deixa de ser prudência e vira coautoria silenciosa na injustiça?",
  "reveal": "Honestidade não é só falar a verdade quando perguntam — é dizer 'isso aqui não é verdade' quando alguém afirma falso na sua frente. O silêncio em fofoca não é neutro: é o combustível que mantém o fogo. Quem cala vira sócio."
}
