{
  "dilemma": "Mariana, 12, recebe a aluna nova: Camila, calada, cabelo no rosto, mochila preta. No primeiro dia, na hora do almoço, Camila come sozinha lendo. Toda a turma já decidiu: 'antissocial, esquisita, melhor deixar quieta'. Mariana sente o mesmo. Pode seguir o grupo, ou pode atravessar o refeitório.",
  "case_a": {
    "title": "Segue o grupo — primeira impressão geralmente acerta",
    "body": "Mariana fica com a turma. Argumento: ninguém forçou a Camila a comer sozinha, foi escolha dela. Se ela quisesse companhia, sentaria perto, sorriria, qualquer coisa. Mariana não quer 'forçar amizade'. Daqui a uns dias, se a Camila mostrar querer interagir, ela pega o sinal. Por enquanto, respeita."
  },
  "case_b": {
    "title": "Atravessa o refeitório, senta junto, pergunta o livro",
    "body": "Mariana levanta, vai. 'Posso?' Camila assente. 'Que livro é esse?'. Argumento: primeira impressão da turma já virou consenso em 4 horas — e consenso de 4 horas sobre alguém que ninguém ouviu não é informação, é eco. Sentar do lado é o único teste que vale; sem ele, o que parece 'reservado' pode ser muito mais coisa."
  },
  "anchor_question": "Quando 'primeira impressão' deixa de ser observação e vira a decisão que impede você de coletar qualquer informação nova?",
  "reveal": "Cérebro humano fecha conclusão sobre uma pessoa em segundos — e depois passa a achar provas pra confirmar essa conclusão (viés de confirmação aplicado a gente). Primeira impressão não é o que você 'sentiu' sobre alguém; é o filtro que vai colorir tudo que vier depois, até virar verdade pra você. Atravessar o refeitório é desligar o filtro."
}
