{
  "dilemma": "Lucas, 12, recebe mesada de R$ 30/mês. Acabou no dia 12. Vê que falta R$ 10 pra fechar a vaquinha do presente do amigo. Pode pedir adiantado pra mãe (que sempre cede com cara fechada), pode usar o dinheiro do almoço da quinta-feira (não come), ou pode dizer 'gente, vou ficar de fora dessa, faltou'.",
  "case_a": {
    "title": "Pede adiantado pra mãe — não é tanto, ela cede",
    "body": "Lucas pede os R$ 10 pra mãe. Argumento: a vaquinha era um compromisso, ele combinou. Se ficar de fora, parece mesquinho. R$ 10 é pouco, a mãe não vai morrer e ele paga semana que vem. Adiantar uma vez não vira hábito; ele faz contas melhor mês que vem."
  },
  "case_b": {
    "title": "Diz que ficou sem — assume o que escassez significa",
    "body": "Lucas escreve no grupo: 'gente, gastei o que tinha, não fecho essa, foi mal'. Argumento: escassez é informação. Pedir emprestado finge que o dinheiro era infinito. Ficar de fora ensina ele a planejar diferente; adiantar ensina que sempre cobre. A vergonha rápida hoje vale uma lição que muda a mesada inteira."
  },
  "anchor_question": "Quando 'pedir emprestado pra não ficar de fora' deixa de ser solução e vira a coisa que impede você de aprender com a escassez?",
  "reveal": "Escassez ensina prioridade — mas só quem encara aprende. Quem cobre com empréstimo nunca sente o limite, então nunca muda. R$ 10 não cobertos no fim do mês não são números: são a aula que o Lucas-de-junho não vai ter. Adultos descobrem isso aos 30, quando o salário é grande e a conta é maior — porque nunca encararam R$ 10 a menos aos 12."
}
