{
  "dilemma": "Bruno, 12, combinou domingo de ajudar o vizinho idoso a montar a estante nova — 14h, sem falta. Sábado à noite, o time chama pra um final improvisado do campeonato da rua, mesmo horário. Os amigos só vão se ele for, é o melhor goleiro. Vizinho mora sozinho e tá esperando faz uma semana.",
  "case_a": {
    "title": "Vai pro jogo, manda mensagem pro vizinho remarcar",
    "body": "Bruno manda: 'seu João, surgiu um imprevisto, posso ir terça?'. Argumento: o vizinho tem a semana toda, o jogo só rola hoje. Final de campeonato não volta. O vizinho vai entender — gente mais velha geralmente entende. Terça dá pra montar a estante tranquilo."
  },
  "case_b": {
    "title": "Vai pra casa do vizinho, perde o jogo",
    "body": "Bruno fala pro time que combinou antes, não dá. Argumento: 'combinei antes' não é tecnicidade — é o que faz a palavra dele valer. Pro time, a final é um jogo a mais (eles arrumam outro). Pro vizinho, foi a semana toda esperando, sozinho. O custo do Bruno não jogar a final é alto pra ele; o custo do vizinho esperar mais é alto pra alguém que conta os dias."
  },
  "anchor_question": "Quando 'surgiu um imprevisto' deixa de ser verdade e vira um jeito formal de dizer 'apareceu algo mais legal'?",
  "reveal": "Compromisso testa quando aperta. Cumprir o combinado quando dá tudo certo é fácil; cumprir quando aparece uma alternativa melhor é o que constrói a fama de palavra firme. Quem só cumpre o fácil acaba descobrindo que ninguém mais combina coisa importante com ele."
}
