{
  "dilemma": "Sara, 11, vê a Manu chegar atrasada de novo, mochila aberta, sem caderno. Professor cobra: '3ª vez na semana — vou avisar sua mãe'. Manu cora. Sara sabe pelos corredores que a mãe da Manu tá doente, que ela ajuda cedo em casa. Falar com o professor ou ficar quieta?",
  "case_a": {
    "title": "Fica quieta — não é o lugar dela",
    "body": "Sara não diz nada. Argumento: a Manu não pediu ajuda. Falar sobre a vida pessoal de alguém sem permissão é violação. Se a Manu quisesse o professor saber, contaria. Sara mete a colher e pode piorar — Manu pode ficar com raiva, e o professor pode sentir manipulado. Melhor cada um cuida do seu."
  },
  "case_b": {
    "title": "Conversa com a Manu, depois com o professor (se a Manu autorizar)",
    "body": "Sara espera o recreio, vai na Manu: 'vi o professor te cobrando, sei que tá pesado em casa — quer que eu fale com ele com você?'. Se Manu disser sim, vão juntas. Se disser não, Sara respeita. Argumento: empatia não é decidir por outro — é oferecer o que ela talvez precise mas não consegue pedir. Perguntar antes preserva a agência dela."
  },
  "anchor_question": "Quando 'respeitar o espaço do outro' vira a desculpa pra não fazer o pequeno desconforto de oferecer ajuda?",
  "reveal": "Empatia tem dois movimentos: imaginar como é estar no lugar do outro e fazer algo com essa imaginação. Imaginar sem agir é só sensibilidade — vira culpa em vez de cuidado. Agir sem perguntar é invasão. O movimento bom é o que junta os dois: ofereço, você escolhe. Compaixão sem agência é piedade; compaixão com agência é solidariedade."
}
